{
  "$schema": "http://json-schema.org/draft-07/schema",
  "$id": "https://electionguard.vote/schemas/1.91/election-context",
  "title": "Ciphertext Election Context",
  "type": "object",
  "required": [
    "number_of_guardians",
    "quorum",
    "elgamal_public_key",
    "commitment_hash",
    "manifest_hash",
    "crypto_base_hash",
    "crypto_extended_base_hash",
    "configuration"
  ],
  "definitions": {
    "ElementModP": {
      "title": "ElementModP",
      "description": "An element of the larger `mod p` space, i.e., in [0, P), where P is a 4096-bit prime.",
      "type": "string"
    },
    "ElementModQ": {
      "title": "ElementModQ",
      "description": "An element of the smaller `mod q` space, i.e., in [0, Q), where Q is a 256-bit prime.",
      "type": "string"
    },
    "Configuration": {
      "title": "Configuration",
      "type": "object",
      "properties": {
        "allow_overvotes": {
          "title": "Allow Overvotes",
          "default": true,
          "type": "boolean"
        },
        "max_votes": {
          "title": "Max Votes",
          "default": 1000000,
          "type": "integer"
        }
      }
    }
  },
  "properties": {
    "number_of_guardians": {
      "title": "Number Of Guardians",
      "type": "integer",
      "description": "The number of guardians necessary to generate the public key"
    },
    "quorum": {
      "title": "Quorum",
      "type": "integer",
      "description": "The quorum of guardians necessary to decrypt an election.  Must be less than or equal to `number_of_guardians`"
    },
    "elgamal_public_key": {
      "$ref": "#/definitions/ElementModP",
      "description": "The `joint public key (K)` in the specification"
    },
    "commitment_hash": {
      "$ref": "#/definitions/ElementModQ",
      "description": "the `commitment hash H(K 1,0 , K 2,0 ... , K n,0 )` of the public commitments guardians make to each other in the specification"
    },
    "manifest_hash": {
      "$ref": "#/definitions/ElementModQ",
      "description": "The hash of the election metadata"
    },
    "crypto_base_hash": {
      "$ref": "#/definitions/ElementModQ",
      "description": "The `base hash code (ùëÑ)` in the specification"
    },
    "crypto_extended_base_hash": {
      "$ref": "#/definitions/ElementModQ",
      "description": "The `extended base hash code (ùëÑ')` in specification"
    },
    "extended_data": {
      "title": "Extended Data",
      "type": ["object", "null"],
      "description": "Data to allow extending the context for special cases",
      "additionalProperties": {
        "type": "string"
      }
    },
    "configuration": {
      "$ref": "#/definitions/Configuration",
      "description": "Configuration for the election edge cases"
    }
  }
}